<?xml version="1.0" encoding="UTF-8" ?>
<!DOCTYPE librairie SYSTEM "Librairie.dtd">
<librairie>
    <entete>Librairie donnée en <strong>exemple</strong>.</entete>
    <livre ISBN="12345">
        <titre>Enseigner le XML</titre>
        <auteur>
                <nom>Paul Dumond</nom>
        </auteur>
        <description>Ce livre parle de l'enseignement du XML.</description>
        <prix devise="euro" tva="5.5" taxe="TTC">12</prix>
    </livre>
    <livre ISBN="67890">
        <titre>Enseigner le Java</titre>
        <collectif>
            <direction>
                <nom>Developpeurs associés</nom>
            </direction>
            <membres>Valérie Durand, Émilie Favin et Paul Dumond</membres>
        </collectif>
        <description> Apprendre <em>Java</em> en s'amusant !. <img src="img.jpg"/></description>
        <prix taxe="TTC" devise="euro" tva="5.5">24</prix>
    </livre>
</librairie>